{
  "version": "0.1.0",
  "updated": "2026-07-26",
  "decision": "D7 spec-gate, adopted by Anthony 2026-06-12 (both wirings: --check audit + post-write hook advisory)",
  "gated_surfaces": [
    "FLOSS/scripts",
    "FLOSS/docs/specs",
    "FLOSS/docs/adr"
  ],
  "exempt_note": "Intake mouths (workspace root, docs/research incl. intake_raw), docs/agent-memory, .agent-surface, tests, caches are NEVER gated — continuation/seed artifacts are pre-spec by definition.",
  "entries": {
    "FLOSS/docs/adr/ADR-0-recognition-protocol.md": {
      "spec": "GRANDFATHERED 2026-06-12 (ADR-0: Recognition Protocol - First Coherent Transmission)",
      "grandfathered": true
    },
    "FLOSS/docs/adr/ADR-0.1-cross-ai-validation.md": {
      "spec": "GRANDFATHERED 2026-06-12 (ADR-0.1: Cross-AI Transmission Validation)",
      "grandfathered": true
    },
    "FLOSS/docs/adr/ADR-1-carrier-equivalence.md": {
      "spec": "GRANDFATHERED 2026-06-12 (ADR-1: The Carrier Equivalence Principle)",
      "grandfathered": true
    },
    "FLOSS/docs/adr/ADR-12-consent-gate-protocol.md": {
      "spec": "GRANDFATHERED 2026-06-12 (ADR-12 — Consent Gate Protocol)",
      "grandfathered": true
    },
    "FLOSS/docs/adr/ADR-13-yumeichan-watch-architecture.md": {
      "spec": "ADR-13: Yumeichan Watch architecture"
    },
    "FLOSS/docs/adr/ADR-14-objectgraph-projection.md": {
      "spec": "ADR-14: Objectgraph projection"
    },
    "FLOSS/docs/adr/ADR-15-provenance-validation-enforcement.md": {
      "spec": "ADR-15: Provenance validation enforcement"
    },
    "FLOSS/docs/adr/ADR-16-omnigent-execution-surface.md": {
      "spec": "ADR-16: Omnigent execution surface"
    },
    "FLOSS/docs/adr/ADR-17-knowledge-triple-contract-reconciliation.md": {
      "spec": "ADR-17: KnowledgeTriple contract reconciliation"
    },
    "FLOSS/docs/adr/ADR-2-holochain-substrate.md": {
      "spec": "GRANDFATHERED 2026-06-12 (ADR-2: Holochain as Runtime Substrate)",
      "grandfathered": true
    },
    "FLOSS/docs/adr/ADR-3-metaprompt-kernelization.md": {
      "spec": "GRANDFATHERED 2026-06-12 (ADR-003: Metaprompt Kernelization)",
      "grandfathered": true
    },
    "FLOSS/docs/adr/ADR-4-spec-driven-development.md": {
      "spec": "GRANDFATHERED 2026-06-12 (ADR-4: Specification-Driven Development with Spec as Source of Truth)",
      "grandfathered": true
    },
    "FLOSS/docs/adr/ADR-5-cognitive-virology-pattern.md": {
      "spec": "GRANDFATHERED 2026-06-12 (ADR-5: Cognitive Virology as Architectural Pattern)",
      "grandfathered": true
    },
    "FLOSS/docs/adr/ADR-6-four-system-integration.md": {
      "spec": "GRANDFATHERED 2026-06-12 (ADR-6: Four-System Meta-Orchestration Integration)",
      "grandfathered": true
    },
    "FLOSS/docs/adr/ADR-7-agpl-cascade.md": {
      "spec": "GRANDFATHERED 2026-06-12 (ADR-7: Embracing AGPL-3.0 Copyleft Cascade)",
      "grandfathered": true
    },
    "FLOSS/docs/adr/ADR-8-radicle-dev-substrate.md": {
      "spec": "GRANDFATHERED 2026-06-12 (ADR-8: Radicle as the Canonical Dev-Plane Code Substrate)",
      "grandfathered": true
    },
    "FLOSS/docs/adr/ADR-9-self-perceptual-evolution.md": {
      "spec": "GRANDFATHERED 2026-06-12 (ADR-9: Self-Perceptual Evolution (n+1))",
      "grandfathered": true
    },
    "FLOSS/docs/adr/ADR-MCP-ORCHESTRATOR.md": {
      "spec": "GRANDFATHERED 2026-06-12 (Status)",
      "grandfathered": true
    },
    "FLOSS/docs/adr/ADR-N-IPFS-Integration-VVS.md": {
      "spec": "GRANDFATHERED 2026-06-12 (ADR-N: IPFS Large File Integration for VVS-Compliant Git Repositories)",
      "grandfathered": true
    },
    "FLOSS/docs/adr/FLOSSI0ULLK-ADR-Suite-v2.0.md": {
      "spec": "GRANDFATHERED 2026-06-12 (FLOSSI0ULLK / ARF — Upgraded ADR Suite v2.0)",
      "grandfathered": true
    },
    "FLOSS/docs/specs/TERNARY_COMPATIBILITY.md": {
      "spec": "GRANDFATHERED 2026-06-12 (Ternary/Signed Gradient Compatibility Map)",
      "grandfathered": true
    },
    "FLOSS/docs/specs/budget-entry.schema.json": {
      "spec": "GRANDFATHERED 2026-06-12 (budget-entry.schema)",
      "grandfathered": true
    },
    "FLOSS/docs/specs/budget-entry.spec.md": {
      "spec": "GRANDFATHERED 2026-06-12 (BudgetEntry Specification)",
      "grandfathered": true
    },
    "FLOSS/docs/specs/consensus-gate.schema.json": {
      "spec": "GRANDFATHERED 2026-06-12 (consensus-gate.schema)",
      "grandfathered": true
    },
    "FLOSS/docs/specs/consensus-gate.spec.md": {
      "spec": "GRANDFATHERED 2026-06-12 (Consensus Gate Specification (Seam 1))",
      "grandfathered": true
    },
    "FLOSS/docs/specs/consent-payload.schema.json": {
      "spec": "GRANDFATHERED 2026-06-12 (consent-payload.schema)",
      "grandfathered": true
    },
    "FLOSS/docs/specs/consent-payload.spec.md": {
      "spec": "GRANDFATHERED 2026-06-12 (Consent Payload Spec)",
      "grandfathered": true
    },
    "FLOSS/docs/specs/harvest-protocol.spec.md": {
      "spec": "GRANDFATHERED 2026-06-12 (HARVEST Protocol Specification)",
      "grandfathered": true
    },
    "FLOSS/docs/specs/heartbeat-runtime-budget.schema.json": {
      "spec": "GRANDFATHERED 2026-06-12 (heartbeat-runtime-budget.schema)",
      "grandfathered": true
    },
    "FLOSS/docs/specs/heartbeat-runtime-budget.spec.md": {
      "spec": "GRANDFATHERED 2026-06-12 (Heartbeat Runtime Budget Spec)",
      "grandfathered": true
    },
    "FLOSS/docs/specs/intake-event.schema.json": {
      "spec": "GRANDFATHERED 2026-06-12 (intake-event.schema)",
      "grandfathered": true
    },
    "FLOSS/docs/specs/intake-event.spec.md": {
      "spec": "GRANDFATHERED 2026-06-12 (Intake Event Specification)",
      "grandfathered": true
    },
    "FLOSS/docs/specs/integrity-provenance-validation.spec.md": {
      "spec": "Specified integrity-zome provenance and authorization validation rules"
    },
    "FLOSS/docs/specs/knowledge-edge.schema.json": {
      "spec": "GRANDFATHERED 2026-06-12 (knowledge-edge.schema)",
      "grandfathered": true
    },
    "FLOSS/docs/specs/knowledge-edge.spec.md": {
      "spec": "GRANDFATHERED 2026-06-12 (KnowledgeEdge Specification)",
      "grandfathered": true
    },
    "FLOSS/docs/specs/knowledge-triple.schema.json": {
      "spec": "GRANDFATHERED 2026-06-12 (knowledge-triple.schema)",
      "grandfathered": true
    },
    "FLOSS/docs/specs/knowledge-triple.spec.md": {
      "spec": "GRANDFATHERED 2026-06-12 (Knowledge Triple Specification)",
      "grandfathered": true
    },
    "FLOSS/docs/specs/openhuman-bridge-experiment.spec.md": {
      "spec": "OpenHuman bridge experiment specification"
    },
    "FLOSS/docs/specs/phase0-substrate-bridge.spec.md": {
      "spec": "GRANDFATHERED 2026-06-12 (Phase 0: Substrate Bridge Validation Spec)",
      "grandfathered": true
    },
    "FLOSS/docs/specs/provenance-packet.schema.json": {
      "spec": "GRANDFATHERED 2026-06-12 (provenance-packet.schema)",
      "grandfathered": true
    },
    "FLOSS/docs/specs/provenance-packet.spec.md": {
      "spec": "GRANDFATHERED 2026-06-12 (Provenance Packet Spec v1.4)",
      "grandfathered": true
    },
    "FLOSS/docs/specs/reasoning-ensemble-mcp.spec.md": {
      "spec": "GRANDFATHERED 2026-06-12 (Reasoning-Ensemble MCP Server Spec)",
      "grandfathered": true
    },
    "FLOSS/docs/specs/reasoning-ensemble-router.spec.md": {
      "spec": "GRANDFATHERED 2026-06-12 (Reasoning-Ensemble Router Spec)",
      "grandfathered": true
    },
    "FLOSS/docs/specs/reasoning-ensemble-synthesizer.spec.md": {
      "spec": "GRANDFATHERED 2026-06-12 (Reasoning-Ensemble Synthesizer Spec)",
      "grandfathered": true
    },
    "FLOSS/docs/specs/rose-node.schema.json": {
      "spec": "GRANDFATHERED 2026-06-12 (rose-node.schema)",
      "grandfathered": true
    },
    "FLOSS/docs/specs/rose-node.spec.md": {
      "spec": "GRANDFATHERED 2026-06-12 (RoseNode Specification)",
      "grandfathered": true
    },
    "FLOSS/docs/specs/self-perceptual-evolution.schema.json": {
      "spec": "GRANDFATHERED 2026-06-12 (self-perceptual-evolution.schema)",
      "grandfathered": true
    },
    "FLOSS/docs/specs/self-perceptual-evolution.spec.md": {
      "spec": "GRANDFATHERED 2026-06-12 (Self-Perceptual Evolution (n+1) Specification)",
      "grandfathered": true
    },
    "FLOSS/docs/specs/spec-gate.spec.md": {
      "spec": "Spec for the -1-layer spec-gate check (D7, adopted 2026-06-12)"
    },
    "FLOSS/docs/specs/spec-registry.json": {
      "spec": "Spec-gate registry: one-line spec stubs for gated artifacts (this file)",
      "spec_ref": "FLOSS/docs/specs/spec-gate.spec.md"
    },
    "FLOSS/docs/specs/spec-registry.schema.json": {
      "spec": "JSON Schema for the spec-gate registry",
      "spec_ref": "FLOSS/docs/specs/spec-gate.spec.md"
    },
    "FLOSS/docs/specs/thought-credential.schema.json": {
      "spec": "GRANDFATHERED 2026-06-12 (thought-credential.schema)",
      "grandfathered": true
    },
    "FLOSS/docs/specs/thought-credential.spec.md": {
      "spec": "GRANDFATHERED 2026-06-12 (ThoughtCredential Specification)",
      "grandfathered": true
    },
    "FLOSS/docs/specs/yumeichan-watch-architecture.spec.md": {
      "spec": "Yumeichan Watch architecture specification"
    },
    "FLOSS/docs/specs/yumeichan-watch-capabilities.schema.json": {
      "spec": "Yumeichan Watch capability-token schema and proof shape"
    },
    "FLOSS/docs/superpowers/specs/preservation-capsule.schema.json": {
      "spec": "Sealed preservation-capsule contract (six planes, digests, restore-test evidence)"
    },
    "FLOSS/docs/superpowers/specs/preservation-manifest.schema.json": {
      "spec": "Preservation salvage-manifest contract: change atoms with source-plane provenance"
    },
    "FLOSS/scripts/artifact_actions.py": {
      "spec": "Allowlisted action runner for Cowork live-artifact GUI buttons"
    },
    "FLOSS/scripts/audit_provenance_packets.py": {
      "spec": "Audit provenance packets: valid / superseded / invalid"
    },